,title,date,contents,link
794,정훈채의 월드컵에세이 실수도 실력도역시 승부의 키는 사람,2010.06.19.,"아침부터 강풍이 불기 시작하더니, 뉴질랜드와 슬로바키아의 경기가 열린 한낮에도 기온이 영상 6도를 넘지 않았다. 나이가 지긋한 대회조직위원회 관계자들도 이런 추위는 난생 처음이라고 했다. 고도와 온도 말고도...",http://news.donga.com/3//20100619/29219069/1
795,한국 첫 원정 16강 그리스 잡았던 거기네,2010.06.19.,그러나 ‘바람의 도시’란 별명이 붙을 만큼 강풍이 부는 지역이기도 하다. 넬슨만델라베이 경기장은 바람을 막기 위해 지붕을 꽃잎 모양으로 만들었다. 하늘에서 내려다보면 해바라기를 닮아 ‘선플라워’라는...,http://news.donga.com/3/all/20100624/29342939/1
796,7 8월에 오래 머무는 강력한 태풍 온다,2010.06.19.,실제로 지난해 일본을 강타한 18호 태풍 멜로르는 시속 139km의 강풍을 동반해 100명이 넘게 실종되는 등 큰 피해를 줬다. 만일 올해 한반도에 태풍이 상륙한다면 강하고 오래 머물 가능성이 크다고 전문가들은 지적했다....,http://news.donga.com/3/all/20100625/29377851/1
797,굿모닝 아프리카6긴 여행이 끝났다,2010.06.19.,"게다가 협곡 아래서 고속으로 상승하는 강풍까지 동반한 뗏장 소낙비였다. 하지만 기분은 좋았다.... 굉음과 강풍, 사정없이 퍼붓는 소낙비 세례 속에서 자연의 힘을 느낄 수 있었다. 이 폭포의 원래 이름을 알면 이런 내...",http://news.donga.com/3/all/20100701/29536565/1
798,인천경기바다위 고속도로 60만이 감탄했다,2010.07.02.,"설계와 시공을 병행하는 공사방식을 도입해 52개월 만에 완공했으며 초속 72m의 강풍과 규모 7의 지진에 견딜 수 있도록 설계된 사실에 놀라게 된다. 인천대교의 규모와 사업구조, 기술력은 이미 세계가 인정해 영국의...",http://news.donga.com/3/all/20100702/29563387/1
799,기고김희정지진 능가하는 사이버재난,2010.07.02.,[동아일보] “남태평양에서 발생한 사이클론이 벵골 만 연안의 인도와 방글라데시를 강타해 시속 160km가 넘는 강풍에 가옥 10만 채가 무너지고 120명이 목숨을 잃었습니다. 중국 칭하이(靑海) 성 위수(玉樹) 현에서 발생한...,http://news.donga.com/3/all/20100702/29581232/1
800,자연과의 전쟁,2010.07.02.,"[동아일보] 시속 80km 강풍… 180cm 깊이 벙커… 정강이 높이 러프… 브리티시오픈 내일 티오프 돌 하나, 풀... 강풍도 무시무시하다. 13일에는 최고 시속 80km의 강풍이 불어 선수들이 연습라운드를 포기하기도 했다....",http://news.donga.com/3/all/20100714/29872229/1
801,강풍 뚫은 무명 돌풍,2010.07.02.,"[동아일보] 브리티시오픈 2R… 웨스트호이젠, 12언더파 단독선두 양용은 2오버파 주춤… 합계 3언더파 공동31위로 밀려 변덕스러운 날씨였다. 잔뜩 흐리다 비가 내리더니 어느새 구름이 걷히고 해가 났다. 잠잠하던...",http://news.donga.com/3/all/20100717/29942909/1
802,프로 벽 높다한들,2010.07.02.,만화영화 주인공과 비슷한 외모로 슈렉이라는 별명이 붙은 우스트히즌은 스코틀랜드 못지않은 강풍으로 유명한 남아공의 해안가에서 골프를 익혀 3라운드까지 티샷이 87.5%나 페어웨이를 지킨 게 선두 질주의 비결....,http://news.donga.com/3/all/20100719/29966402/1
803,김화성 전문기자의 joy 울진 금강소나무숲길 걷기,2010.07.02.,"어쩌면 강풍에 진즉 허리가 부러졌을지도 모른다. 옹이는 좌우 지그재그로 알이 박혀 중심을 잡아준다. 바람이 아무리 불어도, 한쪽으로 치우치지 않는다. 금강소나무는 금강산에서부터 강원도 강릉, 경북 울진 봉화에...",http://news.donga.com/3/all/20100722/30050005/1
804,날씨의 심술이유있는 샷의 변덕,2010.07.26.,강풍으로 유명한 스코틀랜드의 세인트앤드루스 골프장에서 이런 날씨를 만나기란 쉽지 않다. 물론 성적도... 반면 로리 맥길로이(북아일랜드)는 오후에 경기를 시작하면서 강풍과 싸우는 험난한 경기를 치렀다. 당연히...,http://news.donga.com/3//20100726/30107341/1
805,장마전선 북상 제주남해안에 강한 비,2010.07.27.,비가 내리는 동안 이 지역에는 평균 초속 14m의 강풍도 예상된다. 비는 28일 낮 충청 이남지방까지 확대됐다가 오후 늦게 충청지역부터 그치겠다. 전남과 경상도 일부 지역에는 29일 새벽까지 비가 오는 곳이 있겠다....,http://news.donga.com/3/all/20100727/30151152/1
806,조정 대서양 횡단기록 114년만에 경신,2010.07.27.,10m 높이의 파도와 시속 65km의 강풍이 이들을 괴롭혔다. 이 과정에서 배가 두 차례나 뒤집혔고 선원들이 배 밖으로 튕겨나가는 위험한 순간이 적지 않았다. AFP통신은 “4명 모두 식중독에 걸려 고생했다”며...,http://news.donga.com/3/all/20100802/30256882/1
807,태극낭자 무너뜨린 링크스코스란,2010.08.02.,이번 브리티시여자오픈에서도 시시 때때로 불어온 강풍이 선수들을 골탕 먹였다. 대회 장소인 로열... 신지애(22·미래에셋)도 강풍 앞에 무릎을 꿇었다. 3라운드 11번홀에서 드라이버 샷이 바람을 타고 왼쪽으로...,http://news.donga.com/3//20100802/30270952/1
808,태풍 뎬무 10일 제주 상륙,2010.08.02.,[동아일보] 12일까지 남해-동해안 폭우-강풍 10일 오후부터 제주 지역을 시작으로 한국이 제4호 태풍 ‘뎬무... 기상청은 “뎬무가 비록 소형 태풍이지만 일부 지역에서는 지형적 특성으로 갑작스러운 폭우와 강풍도...,http://news.donga.com/3/all/20100810/30410207/1
809,태풍 폭우몰고 남부 강타,2010.08.02.,"중심으로 강풍을 동반한 폭우가 내렸다. 기상청에 따르면 뎬무는 중심기압 980hPa(헥토파스칼), 중심 최대풍속 초속 31m의 중형 태풍으로 11일 부산 지역을 거쳐 12일 오전에는 독도 인근 해상으로 빠져나갈 것으로...",http://news.donga.com/3/all/20100811/30432687/1
810,태풍 뎬무 10일 제주 상륙,2010.08.02.,[동아일보] 12일까지 남해-동해안 폭우-강풍 10일 오후부터 제주 지역을 시작으로 한국이 제4호 태풍 ‘뎬무... 기상청은 “뎬무가 비록 소형 태풍이지만 일부 지역에서는 지형적 특성으로 갑작스러운 폭우와 강풍도...,http://news.donga.com/3/all/20100810/30410207/1
811,태풍 폭우몰고 남부 강타,2010.08.02.,"중심으로 강풍을 동반한 폭우가 내렸다. 기상청에 따르면 뎬무는 중심기압 980hPa(헥토파스칼), 중심 최대풍속 초속 31m의 중형 태풍으로 11일 부산 지역을 거쳐 12일 오전에는 독도 인근 해상으로 빠져나갈 것으로...",http://news.donga.com/3/all/20100811/30432687/1
812,2007년 토네이도로 초토화  풍력발전으로 우뚝 그린즈버그의 그린 혁명,2010.08.02.,시속 320km의 강풍을 동반한 거대한 구름 기둥이 도시 전체를 덮쳤다. 구름 기둥의 너비만 3km에 이르렀다. 일반 가정집은 물론이고 시청 법원 등 공공시설과 상점이 쓰러져 내렸고 주차돼 있던 자동차들이 지붕 위로...,http://news.donga.com/3/all/20100813/30481195/1
813,강원문닫은 해수욕장 물놀이 안전비상,2010.08.31.,이에 앞서 28일 오후 6시 5분 삼척시 갈남항 앞바다에서 튜브를 타고 물놀이를 하던 박모 씨(43·강원 정선군) 등 2명이 강풍으로 1km 해상까지 떠밀려갔다가 긴급 출동한 해경에 의해 무사히 구조됐다. 또 같은 날 오후 6시...,http://news.donga.com/3/all/20100830/30853820/1
814,태풍 곤파스 북상 모레 한반도 영향권,2010.08.31.,"곤파스가 북상하면서 한반도에는 고온다습한 바람과 기류가 강하게 유입돼 많은 강수와 강풍이 올 것으로 예보됐다. 특히 제주도, 남해안과 지리산 부근은 1일부터 2일까지 국지적으로 많은 비가 내릴 것으로...",http://news.donga.com/3/all/20100831/30855051/1
815,곤파스 오늘 한반도 관통 서울 경기 등 수도권 초비상,2010.08.31.,"곤파스는 1일 오후 내내 강풍 반경 280∼300km, 시간당 25∼40km의 이동 속도를 유지하며 북진했다. 이동 속도가 빠른 데다 동반하는 비와 바람의 세기가 강한 편이다. 이동 중 평년(28도)보다 수온이 3도가량 높아진 일본...",http://news.donga.com/3/all/20100902/30910299/1
816,태풍 곤파스 곳곳 물폭탄 오늘낮 강화거쳐 수도권 상륙,2010.08.31.,올해 발생한 태풍 중 가장 강력한 곤파스는 1일 오후 3시까지 강풍반경 300km의 중형 태풍 형태를 유지했지만 해수면 온도가 27도 미만인 서해를 지나면서 점차 줄어들어 오후 4시 반경 280km를 기록하는 등 세력이 다소...,http://news.donga.com/3/all/20100902/30911472/1
817,횡설수설정성희 서울의 태풍,2010.08.31.,강풍으로 벼가 쓰러지고 수확을 앞둔 사과 배 등이 떨어져 과수농가들이 타격을 입었다. 어선들이 조업을 하지 못해 생선 가격도 급등했다. 농수산물의 최대 성수기인 추석을 앞두고 식탁물가에 비상이 걸렸다. 9월 들어...,http://news.donga.com/3/all/20100902/30933032/1
818,태풍 곤파스 한반도 강타역 3번출구 조심 뉴스 압도한 트위터,2010.08.31.,특히 한 시민이 트위터에 올린 “강풍에 아파트 베란다 유리창이 깨지고 있습니다. 신문지에 물을 적셔서 유리창에 붙이면 깨짐이 방지된다”는 글이 인기를 끌었다. ▲동영상=태풍 ‘곤파스’에 의해 심하게...,http://news.donga.com/3/all/20100903/30938547/1
819,태풍 곤파스 한반도 강타유리창 박살 아찔 지하철 불통 휘청거린 아침,2010.08.31.,"주요 간선도로와 한강 다리에선 강풍 때문에 차량이 심하게 흔들려 비상등을 켜고 서행해야 했다. 성북구 장위동과 양천구 목동, 올림픽대교 남단 사거리 등 일부 지역에선 정전으로 신호등이 작동하지 않아 차량이...",http://news.donga.com/3/all/20100903/30938524/1
820,무서운 태풍 인천월드컵경기장 너덜너덜,2010.08.31.,순간 최고 초속 30m를 넘나드는 강풍에 이날 새벽 경기장 지붕막 24개 가운데 동남쪽의 7개가 찢어졌다. 피해액은 100억 원 안팎이나 된다. 허 감독은 4일 오후 8시 부산과의 홈경기에서 뜻 깊은 K리그 복귀전을 치른다....,http://news.donga.com/3/all/20100903/30939539/1
821,채소과일 태풍 직격탄 추석의 시름,2010.08.31.,태풍 곤파스가 수도권 등 중부지방을 관통하면서 강풍과 함께 많은 비를 뿌려 이날 오전 6시 반경 경기 성남시 분당구 구미동 까치마을에서 주민 현모 씨(37)가 강풍에 부러진 가로수에 머리를 맞아 숨지는 등 5명이...,http://news.donga.com/3/all/20100903/30939569/1
822,문학경기장 지붕 너덜너덜목동구장 그물망 찢어져,2010.09.03.,"최대 풍속 52.4m의 강풍(10년 만에 최고)이 인천, 강화지역부터 수도권, 중부지방을 강타해 수억 원의 피해를... 새벽에 불어 닥친 강풍으로 구장 홈플레이트 뒤쪽 지붕을 덮고 있는 철판이 휘어지고 틈새가 벌어져...",http://news.donga.com/3//20100903/30936348/1
823,태풍에 붕괴된 골프연습장 당분간 복구 힘들어,2010.09.03.,인천의 한 골프연습장은 미처 강풍에 대비하지 못해 철제 탑 20여개가 모조리 쓰러져 복구비용만 수십 억 원에 달할 것으로 알려졌다. 이 연습장 관계자는 “영업을 못하는 것은 고사하고 공사가 언제 끌날 지 예상하기도...,http://news.donga.com/3//20100903/30954760/1
824,태풍 말로 발생 6일 한반도 북상 할수도,2010.09.03.,"말로는 강풍 반경 300km 미만의 소형 태풍으로, 최대풍속 초속은 18m, 강풍 반경은 200km다. 말로가 한반도로 북상할지는 북태평양고기압의 확장 여부에 달렸다. 말로가 이동하며 바다로부터 많은 수증기를 공급받을 경우...",http://news.donga.com/3/all/20100904/30961777/1
825,채소과일값 폭등세 한달이상 갈듯,2010.09.03.,"9월 초부터 추석까지 판매할 물량이 몰려 있는 경기 남양주시의 경우, 강풍으로 인한 피해가 수확 물량의 35∼40%에 달한다. 애호박 고추 피망 가지 양배추 등 과채류는 주요 산지인 강원 홍천과 평창군 일부 지역의 농장이...",http://news.donga.com/3/all/20100905/30986357/1
826,태풍 말로 내일 오후 목포부근 상륙,2010.09.03.,"기상청에 따르면 말로는 현재 중심기압 994hPa(헥토파스칼), 최대풍속 초속 21m, 강풍반경 220km의 약한 소형급 태풍이다. 기상청은 말로가 7일 오전 서귀포시 서북쪽 약 70km 부근 해상으로 접근한 뒤 이날 오후 전남...",http://news.donga.com/3/all/20100906/30988444/1
827,신나는 공부 녀 남 학교의 스타가 될 것인가 희대의 망신 당할 것인가,2010.09.07.,최근엔 태풍 곤파스가 가져온 강풍 탓에 길을 걷다 넘어진 한 젊은 여성의 모습이 TV 뉴스에 나간 뒤 ‘태풍녀’ 혹은 ‘곤파스녀’란 신조어가 검색어 1위를 차지하기도 했다. 한 케이블TV 프로그램은 ‘순정녀(순위 정하는...,http://news.donga.com/3/all/20100906/31001539/1
828,오늘 남해안 스쳐 동해로,2010.09.07.,말로가 한반도에 상륙하지 않아도 강풍과 폭우를 동반할 것으로 보인다. 태풍이 몰고 온 덥고 습한 열대공기가 먼저 한반도에 들어오면서 상공의 차가운 공기와 부딪쳐 비구름대를 형성할 가능성이 높기 때문이다....,http://news.donga.com/3/all/20100907/31013836/1
829,다시 돌아온 희귀 식물들 분화구 안에서 가을 향연,2010.09.07.,"호우와 강풍에 씻겨나가는 것을 막기 위해 길이 30cm가량의 나무말뚝을 박았다. 등산객 몰리며 4만㎡ 훼손, 출입통제 뒤 무너진 곳 복구 문제는 식물이 뿌리내리는 것. 흙을 잡아주는 능력이 뛰어난 김의털, 검정겨이삭...",http://news.donga.com/3/all/20100908/31039553/1
830,광주전남농약비료 제로 한국판 기적의 사과 수확,2010.09.09.,인공적인 것은 강풍 피해를 막기 위해 세운 지주대 등이 전부다. 이처럼 재배한 사과는 쉽게 썩지 않고 단단해 ‘기적의 사과’로 불린다. 농약과 비료를 쓴 같은 수령의 사과나무에서 그루당 120여 개씩을 수확할 수...,http://news.donga.com/3/all/20100909/31065599/1
831,뉴스테이션동아논평기후변화 적응대책 중요성 확인해준 물 폭탄,2010.09.24.,폭우와 강풍을 이겨내고 수확을 앞두었던 농작물도 큰 피해를 입었습니다. 예상을 뛰어넘는 게릴라성 집중호우에 기상청은 속수무책이었습니다. 최근 기상현상은 우리의 경험칙을 뛰어넘고 있습니다. 올해만 해도...,http://news.donga.com/3/all/20100924/31376189/1
832,2004년 악몽에 휩싸이다,2010.09.24.,진앙인 믄타와이 군도는 수마트라 섬에서 10시간 이상 배를 타고 들어가야 하는 오지인 데다 강풍과 해일마저 일어 헬리콥터 등을 이용한 구호에 차질이 빚어졌다. 사고 현장에선 실종자 수색작업이 더디게 진행되는...,http://news.donga.com/3/all/20101028/32174412/1
833,강풍에 훈련호남권 참사 불렀다,2010.10.30.,[스포츠동아] 우승후보 김민철·김배영 부상 김민철-머리·폐 큰 부상…선수생명 위기 김배영-쇄골골절 6주 더 치료…시즌아웃 핵심선수 줄부상 그랑프리 V ‘빨간불’ 거칠 것이 없던 호남권 팀의 맏형 김배영(11기·광주)...,http://news.donga.com/3//20101030/32226132/1
834,쌍끌이어선 1척 침몰9명 사망 또는 실종,2010.11.08.,"사고가 나자 해경은 헬기 1대를 급파하고, 경비함 4척을 보내 구조작업에 나섰으나 사고 해역에 초속 20~24m에 이르는 강풍이 불고, 파고가 4~5m로 높아 구조에 어려움을 겪고 있다. 올 8월 인천 연안부두에서 출항해...",http://news.donga.com/3/all/20101108/32433887/1
835,인천 앞바다서 쌍끌이 어선 침몰 9명 사망실종,2010.11.08.,사고가 나자 해경은 헬기 1대를 급파하고 경비함 4척을 보내 구조작업에 나섰으나 사고 해역에 초속 20∼24m에 이르는 강풍이 불고 파고가 4∼5m로 높아 구조에 어려움을 겪고 있다. ▽실종자 명단 △박현중(53·선장...,http://news.donga.com/3/all/20101109/32451687/1
836,홀컵향해 활 시위 과녁향해 아이언샷 정확도 승자는 였다,2010.11.08.,하지만 120m 거리에서는 초속 7m에 이르는 강풍과 추위의 악조건으로 각자 5차례의 도전에도 한 명도 성공시키지 못했다. 연장전에 들어가 배희경과 이가람이 각각 한 차례 성공해 결국 우열을 가리지 못했다. 이보미는...,http://news.donga.com/3/all/20101110/32478910/1
837,호주마스터스 2 우즈 공동 16위 그쳐,2010.11.12.,우즈는 “오늘처럼 강풍이 불면 예전의 스윙으로 다시 돌아가는 경향이 나타난다. 아이언 샷이 전혀 날카롭지 못했다”며 자신의 플레이를 평가했다. 세르히오 가르시아(스페인)는 2라운드에서 6언더파 65타를...,http://news.donga.com/3//20101112/32555794/1
838,123층 롯데수퍼타워 착공 서울 랜드마크로,2010.11.12.,"롯데물산은 부산 주상복합아파트 화재를 계기로 제기된 초고층빌딩의 위험성에 대해 25층마다 1개씩 총 5개의 피난층과 피난용 엘리베이터 17대를 설치했으며 초속 70m의 강풍, 리히터규모 7.0의 지진에도 견딜 수 있도록...",http://news.donga.com/3/all/20101124/32842450/1
839,허영만의 자전거 식객 시화방조제 피빨이 레이스아 바람아 멈추어다오,2010.11.25.,"비는 점점 굵어졌고, 설상가상 강풍에 천둥번개까지 가세했다. 매트리스 위에 침낭만 덮은 상태였던 우리들은 차가운 가을비에 젖어가며 허둥지둥 텐트를 쳤으나 텐트를 다 치고 나자 이미 온몸이 젖어버렸다. 자전거를...",http://news.donga.com/3//20101125/32845365/1
840,퇴근길에도 안개 주의밤새 더 짙어질듯,2010.12.01.,"오후부터 서해안 지방과 내륙지방을 중심으로 바람이 강하게 불겠다. 해상에서도 강풍이 불고 물결이 점차 높아질 것으로 보여 항해나 어업을 하는 선박은 주의해야 한다""고 말했다. 인터넷 뉴스팀 《 화제의 뉴스 》",http://news.donga.com/3/all/20101201/32986633/1
841,충북청주종합경기장 2012년 10월까지 보수공사,2010.12.02.,청주시는 복권기금 3억 원과 지방비 7억 원 등 10억 원을 들여 2012년까지 잔디 교체 공사를 마칠 예정이다. 또 최근 강풍으로 쓰러진 전광탑도 이달에 철거한 뒤 내년 상반기(1∼6월)까지 재설치하는 방안을 검토하고 있다.,http://news.donga.com/3/all/20101201/33006411/1
842,내일 강풍에 기온 뚝 떨어진다서울 아침 1도,2010.12.02.,"[동아일보] 금요일인 3일 전국이 대체로 맑지만 새벽 한때 구름이 많이 끼겠고, 강원 산지에는 곳에 따라 한때 비 또는 눈(강수확률 60%)이 올 전망이다. 전라 서해안과 제주는 아침에 산발적으로 약한 눈이 날리거나...",http://news.donga.com/3/all/20101202/33015718/1
843,전국에 황사남부지방 3일 오전까지,2010.12.02.,"[동아일보] 내륙ㆍ산간에 강풍 동반 비ㆍ우박…3일 추위 중국 고비사막 등에서 발생한 황사가 북서풍을 타고... 번개, 강풍을 동반한 비나 우박이 내리는 곳이 있을 것으로 기상청은 내다봤다. 해상에서는 이날 서해 중부...",http://news.donga.com/3/all/20101202/33025273/1
844,김민휘에 이어 박일환마저 스쿨 통과 실패,2010.12.03.,"한편 4라운드 72홀 경기로 치러질 Q스쿨은 강풍으로 정상적인 진행이 어려워 36홀 경기로 축소됐다. 국가대표 상비군 출신 변진재(21)는 2라운드 합계 8언더파 136타를 쳐 1위로 Q스쿨을 통과했고, 아시안게임 국가대표...",http://news.donga.com/3//20101203/33053335/1
845,낮부터 강풍에 추위 내일 서울 5도,2010.12.06.,[동아일보] 6일 오후부터 찬바람이 강하게 불면서 추워질 전망이다. 기상청은 이날 찬 대륙고기압의 영향으로 낮부터 바람이 강하게 불면서 기온이 떨어져 7일 아침 전국 대부분 지방의 수은주가 영하로 내려갈 것이라고...,http://news.donga.com/3/all/20101206/33098074/1
846,안갯속 그린 라운드 축소 잇따라 고향땅서 컷탈락양용은의 굴욕,2010.12.11.,월드컵 개막을 앞둔 6월 10일 상반기 마지막 대회로 열린 에쓰오일 챔피언십은 강풍과 비 때문에 2라운드 경기로 우승자를 가렸다. 제주 엘리시안 골프장에서 열린 마지막 날 3라운드 경기가 오전부터 계속된 강풍으로...,http://news.donga.com/3//20101211/33219095/1
847,산에서는 길을 묻지 말라,2010.12.13.,"강풍이 불면 그동안 느끼지 못하고 있던 바짓가랑이, 허리춤, 목부위 등 조금이라도 틈이 있는 곳이면 찬바람은 파고든다. 초속 1m의 바람으로 체감온도는 대략 섭씨 2도정도 내려간다고 기억해두면 편하다....",http://news.donga.com/3/all/20101213/33260104/1
848,천재골퍼 송아리 4년 잠 깨나,2010.12.13.,10대 소녀에서 어느새 20대 중반이 된 그는 13일 미국 플로리다 주 데이토나비치의 LPGA 인터내셔널 코스(파72)에서 열린 퀄리파잉스쿨 5라운드에서 최고 시속 48km의 강풍 속에서 1타를 잃었지만 합계 6언더파 354타로...,http://news.donga.com/3/all/20101214/33268463/1
849,낮부터 기온 뚝밤에는 서해안에 많은 눈,2010.12.14.,"기상청 관계자는 ""서해 5도와 흑산도, 홍도에는 강풍주의보가, 서해 남부 및 남해 앞바다와 동해 중부를 제외한 전 해상에 풍랑주의보가 발효돼 항해나 어업을 하는 선박은 주의해야 한다""고 말했다. 15일은 아침...",http://news.donga.com/3/all/20101214/33272924/1
850,인성호 선원 사고보고서로 본 침몰 원인,2010.12.14.,원인을 강풍이나 너울로 추정해 볼 수 있는 단서들이 있다. 최씨는 사고보고서에서 사고 당일인 13일 오전... 강풍이나 너울이 배의 왼쪽 측면을 때려 배가 오른쪽으로 기울자 선수를 9시 방향으로 긴급히튼 것이다. 선수를...,http://news.donga.com/3/all/20101214/33280154/1
851,전국 강추위 몰려와강풍에 체감온도 더 낮아,2010.12.15.,"강풍에 체감온도는 더 떨어져 현재 서울의 체감온도가 영하 17.3도, 대관령 영하 29.9도, 대전 영하 10.6도, 광주 영하 13.2도 등이다. 전국적으로 기온이 큰 폭으로 내려가 강원 평창에 한파경보가, 서울 인천 대전 대구...",http://news.donga.com/3/all/20101215/33293668/1
852,한파 크리스마스 오늘 서울 영하13도,2010.12.15.,"기상청은 23일 “차가운 대륙고기압의 영향으로 23일 오후부터 강풍이 불기 시작해 24일 아침 최저기온이 서울 영하 13도, 수원 영하 12도, 춘천 영하 13도, 대관령 영하 15도, 충주 영하 12도, 대전 영하 10도, 전주...",http://news.donga.com/3/all/20101224/33480075/1
853,신안 앞바다 화물선 침몰 1시간만에 15명 전원 구조,2010.12.15.,"[동아일보] 해경, 강풍-한파 死線 넘어 ‘퍼펙트 구조’ 26일 오전 9시 13분 전남 신안군 흑산면 만재도 남쪽... 김 함장은 “최고 시속 53km까지 낼 수 있지만 높은 파도와 초속 16m 안팎의 강풍이 고속 운항을...",http://news.donga.com/3/all/20101227/33521995/1
854,뉴스파일신안 화물선 차량 제대로 안묶어 전복 선장 입건,2010.12.28.,25t 화물차 1대와 5t 화물차 3대에 결박(고박)장치를 제대로 설치하지 않은 혐의를 받고 있다. 이 화물선은 3시간 뒤 4m에 이르는 높은 파도와 초속 16m 안팎의 강풍에 화물차 4대가 균형을 잃고 오른쪽으로 쏠려 전복됐다.,http://news.donga.com/3/all/20101228/33543777/1
855,목숨 건 구조 해경 3009함 승조원 3명 특진37명 표창,2010.12.29.,[동아일보] 목포 해경은 4m가 넘는 높은 파도와 강풍 속에서 목숨을 걸고 전복된 화물선에 탄 15명의 생명을 구한 3009함 승조원 40명 전원에게 특진 또는 표창을 주기로 했다고 28일 밝혔다. 해경은 구조에 공을 세운...,http://news.donga.com/3/all/20101228/33567374/1
856,광주전남목숨 건 구조 그대들이 영웅입니다,2010.12.31.,[동아일보] 목포해경 3009함 승조원 어제 전원 포상 높은 파도와 강풍을 뚫고 15명의 귀중한 생명을 구한 목포해경 3009함 승조원이 전원 포상을 받았다. 목포해경은 30일 3009함 승조원 이명수 경사(41)와 윤청금 경장(39)...,http://news.donga.com/3/all/20101231/33621763/1
