,title,date,contents,link
2436,시민 놀라게 한 서울날씨강풍과 비의 콜라보 밤 같다,2017.05.13.,"강풍과 비의 콜라보. 서울 온지 다섯 시간만에 어서 집 가야겠다는 생각이 들게 만들었음”이라고 말했으며, mode****는 “와 지금 서울 날씨 왜이래요? 갑자기 밤되고 태풍이? 바람이 불고 난리났네”라고 전했다....",http://news.donga.com/3/all/20170513/84341502/2
2437,시론이기환산불 컨트롤타워 전문가에 맡겨야,2017.05.13.,공교롭게도 불어온 강풍의 영향이 있긴 했으나 그것만을 원인으로 보기에는 부족하다. 위험을 알려야 할 여러 관계 기관 중 한 곳도 지역 주민들과 관광객들에게 재난문자를 보내지 않았다는 점도 심각한 문제다. 재난이...,http://news.donga.com/3/all/20170515/84357641/1
2438,모처럼 맑게 갠 서울 하늘 15일도 전국 강풍,2017.05.13.,"스승의 날인 15일에는 전국적으로 강풍이 심할 것으로 보인다. 예보에 따르면 낮 최고기온은 평년 수준인 17∼25도이며, 미세먼지 농도는 ‘보통’이다. ▶ 동아일보 단독 / 동아일보 공식 페이스북 ▶ ""아직도 당신만...",http://news.donga.com/3/all/20170514/84357046/1
2439,미세먼지 농도 심각실내체육관 갖춘 아파트 관심,2017.05.20.,"미세먼지 위험을 피해갈 수 있는 것은 물론, 계절과 기온 등에 상관없이 이용이 가능하기 때문에 장마철이나 폭염 및 강풍 발생 시에 이용하기 적합하다. 더구나 단지 내 이웃들과 같이 이용할 수 있어 이웃간의...",http://bizn.donga.com/realestate/3/all/20170519/84445577/2
2440,졸음위험 내리막길 올림픽 공사영동고속 곳곳 사고위험,2017.05.20.,특히 영동고속도로는 1년 중 120일가량 안개가 끼고 강풍까지 자주 나타나는 등 변화무쌍한 날씨로 악명이 높다. 이런 상황을 모르는 운전자가 놀라서 운전대를 급하게 조작하거나 급제동을 걸었을 때 자칫 큰 사고로...,http://news.donga.com/3/all/20170525/84551377/1
2441,빠르고 민첩 한 치의 밀림도 허용 못해,2017.05.20.,마세라티는 “온화한 바람에서 강풍으로 돌변하는 지중해의 바람처럼 감각적인 외관과 우수한 주행능력을 상징하는 이름”이라고 설명했다. 르반떼는 차체가 동급 SUV에 비해 낮게 설계돼 공기저항계수가 0.31까지...,http://news.donga.com/3/all/20170525/84560213/1
2442,마세라티 프리미어리거 손흥민 선수에 르반떼 의전 차량 지원,2017.06.01.,온화한 바람에서 순간 강풍으로 돌변하는 ‘지중해의 바람’이라는 의미를 지닌 모델로 마세라티 특유의 디자인 철학과 우수한 퍼포먼스를 갖춘 것이 특징이다. 마세라티 공식 수입사 FMK 관계자는 “르반떼는 정교한...,http://bizn.donga.com/car/3/all/20170601/84674620/2
2443,이번엔 울산 우박포도알만 한 우박 떨어져 울산 날씨 강풍에 천둥,2017.06.01.,"[동아닷컴] 사진=인스타그램1일 오후 울산에 우박이 쏟아지고 있다. 이날 트위터, 인스타그램과 여러 온라인 커뮤니티에서는 울산 지역에서 우박이 떨어진다는 제보가 이어지고 있다. 몇몇 공개된 사진에는 포도알...",http://news.donga.com/3/all/20170601/84678624/2
2444,서울 상계동 수락산서 대형산불,2017.06.01.,[동아일보] 초속 5m 강풍 타고 불길 확산… 소방인력 2000여명 밤샘 진화 인명 피해 아직 확인 안돼 1일 서울 노원구 수락산에서 큰불이 발생했다. 국민안전처에 따르면 이날 오후 9시 8분경 상계동 상계주공아파트 13...,http://news.donga.com/3/all/20170602/84684872/1
2445,이젠 평창이다한화성화봉 제작 꺼지지 않는 불꽃 눈길,2017.06.01.,[동아일보] 강풍 고려해 제작… 4개로 분리된 구조 개회식 불꽃쇼 진행 평창동계올림픽 홍보대사 김연아... 겨울철 강풍과 폭설을 고려해 제작한 덕에 다양한 환경에서도 ‘꺼지지 않는 불꽃’을 유지하도록 한 것이...,http://news.donga.com/3/all/20170601/84672617/1
2446,수락산 산불 큰불 완전히 진압축구장 55배 면적 태워,2017.06.02.,불은 전날(1일) 오후 9시8분쯤 서울 노원구 상계동 수락산 귀임봉 5부 능선에서 발생해 초속 5m의 강풍을 타고 빠른 속도로 정상부근까지 확산됐다. 거세게 확산되던 불길을 잡기 위해 소방당국은 차량 60여대와 인원...,http://news.donga.com/3/all/20170602/84686436/2
2447,이낙연 수락산 큰불 거의 진압잔불 정리만 남았다,2017.06.02.,"불은 초속 5m의 강풍을 타고 빠른 속도로 정상부근까지 확산했고, 화재 발생 5시간17분 만에 초진이 이뤄졌다. 소방당국은 이번 산불로 축구장 5.5배 면적에 달하는 3만9600m²를 태운 것으로 추산했다. 동아닷컴...",http://news.donga.com/3/all/20170602/84687097/2
2448,포르투갈 최악 산불 최소 62명 사망,2017.06.02.,[동아일보] 강풍 타고 삽시간에 번져 통제불능… 피난길 올랐다가 도로 위에서 고립 30명 이상 자동차 안에 갇혀 희생 포르투갈 중부에서 큰 산불이 발생해 최소 62명이 숨지는 참사가 일어났다. 강풍으로 불이 삽시간에...,http://news.donga.com/3/all/20170618/84944750/1
2449,르포광명 부동산 개점휴업 은밀한 분양권 거래는 계속,2017.06.21.,분양권 매매나 전세 계약은 카페에 가서 해야 합니다. ” 최근 2~3년간 승승장구하던 경기도 광명시 부동산 시장에 매서운 ‘강풍’이 불어 닥쳤다. 문재인 정부의 ‘6.19 부동산 대책’에 광명이 포함되자 20일 경기도...,http://bizn.donga.com/realestate/3/all/20170620/84977049/3
2450,호국 보훈의 달대한민국 안보안전 토종헬기 수리온이 지킨다,2017.06.21.,최근 야간·강풍으로 골든타임을 놓치며 산불 진화에 어려움을 겪었던 산림청도 수리온 산림헬기를 늘려 국민안전과 재산 보호에 더욱 만전을 기한다는 방침이다. 현재 KAI는 수리온 해외시장 진출을 추진 중이다....,http://news.donga.com/3/all/20170622/85004529/1
2451,최고의 힐링 로드 호미반도 해안둘레길이 뜬다,2017.06.30.,"해안둘레길 상당 구간이 바다와 접해 있어 강풍, 풍랑, 해일 같은 기상특보가 발효되면 출입할 수 없다. 이강덕 포항시장은 “아름다운 물빛 풍경을 감상하며 걸을 수 있는 최고의 힐링(치유) 코스”라며 “포항의...",http://news.donga.com/3/all/20170629/85130723/1
2452,서부 산불 잇따라주민 수천 명 대피,2017.06.30.,보도에 따르면 도시 교외 지역 83㎢를 태운 산불은 건조한 강풍을 타고 확산하고 있다. 산불이 난 프레스콧은 지난 2013년에도 대형 산불이 발생해 소방관 19명이 희생된 곳이다. 프레스콧 외에도 캘리포니아·유타...,http://news.donga.com/3/all/20170630/85134211/2
2453,태풍 난마돌 북상 기상청 제주도 직접 영향권 밖,2017.07.03.,제주도 남쪽 해상을 지날 때 태풍 난마돌은 중심기압 990헥토파스칼(hPa)의 약한 소형 태풍으로 강풍반경이 180km에 이른다. 태풍의 예상경로가 조금 더 남쪽으로 이동하면서 제주 전역이 태풍의 직접 영향권역에서...,http://news.donga.com/3/all/20170703/85170807/2
2454,태풍 난마돌 규슈 상륙 시간당 50mm 폭우 경로 한반도엔 영향,2017.07.04.,중심기압 985헥토파스칼(hPa)의 소형 태풍 난마돌 중심부근에는 최대 30m/s의 강풍이 불고 있다. 태풍이 지나는 규슈 일부 지역에서는 시간당 최대 57mm의 폭우가 쏟아졌다. 일본 기상청은 5일 오전까지 시코쿠에 최대...,http://news.donga.com/3/all/20170704/85186462/2
2455,비 새는 낡은 집 어김없이 나타난다 서산 장마철 산타,2017.07.04.,강풍에 날아간 지붕을 다시 덮다 아버지는 수시로 다쳤다. 농업고등학교에 다니며 각종 기술을 익힌 최 씨는 아버지 대신 지붕 위로 올라 집을 고쳐 나갔다. 졸업할 무렵 비로소 ‘살 만한’ 집이 됐단다. 최 씨는 “집다운...,http://news.donga.com/3/all/20170711/85291405/1
2456,기습폭우 속 태풍 노루선까 발생예상경로와 한반도에 끼칠 영향은,2017.07.24.,중심기압 970헥토파스칼(hPa)의 강한 중형 태풍으로 강풍반경이 330km에 이른다. 태풍의 경로는 유동적이나 일본 열도나 한반도를 향해 북상하지는 않을 것으로 보여 우리나라에는 거의 영향을 끼치지 않을 전망이다....,http://news.donga.com/3/all/20170724/85492189/2
2457,인천대교도 12월부터 구간 과속단속,2017.07.25.,평소 인천대교는 강풍이 자주 부는 데다 짙은 안개가 낄 때가 많아 사고 위험성이 높다. 시정 250m 이하의 안개가 연평균 37일(2014년 기준) 발생하고 있다. 안개 낀 고속도로의 교통사고 치사율은 눈비가 올 때보다 3배...,http://news.donga.com/3/all/20170724/85506716/1
2458,태풍 네삿 하이탕 연달아 대만 상륙 이동 방향은,2017.07.30.,"네삿은 강풍과 폭우를 동반한 채 쑤아오(蘇澳)에 도착해 피해를 입히고 이날 새벽 대만섬을 빠져나갔다. 이로 인해 대만 전역에서는 철도 서부간선과 동부간선, 남회선 모두 전면적으로 운행 중단됐고, 항공편도...",http://news.donga.com/3/all/20170730/85592987/2
2459,액땜이 행운으로 마음 비운 이미향 6타차 뒤집기,2017.07.30.,"강풍, 추위와 싸운 이미향은 “거센 바람 속에 퍼트 연습에 집중했던 효과를 보면서 자신감을 되찾았다. 내가 우승해 인터뷰하는 꿈을 꿨다는 고모의 연락으로 좋은 기운을 받았다”며 웃었다. 전반에만 5타를 줄이며...",http://news.donga.com/3/all/20170801/85611637/1
2460,태풍 노루 서귀포 방향으로 서북서진한반도 영향은,2017.08.01.,기상청에 따르면 태풍 노루는 이날 오전 3시경 중심기압 935 헥토파스칼(hPa)에 최대풍속 초속 49m 강풍을 동반한 채 일본 도쿄 남쪽 약 1380km 부근 해상에서 제주 서귀포방향으로 서북서진하고 있다. 오는 4일에는 도쿄...,http://news.donga.com/3/all/20170801/85612745/2
2461,태풍 노루 6일 남부 지방에 직접 영향제주 향해 북상,2017.08.01.,"1일 기상청에 따르면 태풍 노루는 이날 오전 9시 현재 중심기압 940 헥토파스칼(hPa), 최대풍속 47m/s(시속 169km), 강풍반경 320km의 매우 강한 중형 태풍으로 성장해 일본 도쿄 남쪽 약 1340㎞ 부근 해상을 지나 시속 13km의...",http://news.donga.com/3/all/20170801/85614555/2
2462,주말 한반도 태풍 노루 직간접 영향권2012년 루사에 버금,2017.08.01.,"169km), 강풍반경 320km의 매우 강한 중형 태풍의 세력을 유지하고 있다. 일본 도쿄 남쪽 약 1340㎞ 부근... 기상청은 태풍 노루가 일본 규슈 서남부에 바짝 다가 설 5일과 6일 중심기압 960hPa, 최대풍속은 39m/s, 강풍반경...",http://news.donga.com/3/all/20170801/85617197/2
2463,북상 태풍 노루 경로  규슈 관통 확실시 폭염 식혀줄 착한 태풍 기대,2017.08.04.,우리나라는 제주도와 남해안 일부 지역이 7일 새벽 폭풍 경계역 안에 들어가 강풍과 강수 영향을 받을 확률이 높다. 태풍 노루의 경로가 일본 열도를 향할 것이 확실시 되면서 우리나라 입장에선 폭염을 잠시나마...,http://news.donga.com/3/all/20170804/85681342/2
2464,평창이 부른다개폐회식 불꽃쇼성화봉 등 250억원 지원,2017.08.04.,"겨울철 강풍과 폭설을 고려해 제작해 ‘꺼지지 않는 불꽃’을 유지하도록 했다. 4개로 분리된 격벽 구조로, 바람이 불면 성화봉의 불꽃이 격벽 반대 방향의 산소 공급원 방향으로 이동하게 돼 불꽃이 꺼지지 않는다....",http://news.donga.com/3/all/20170808/85731632/1
2465,인천대교 통행료 15일부터 인하,2017.08.04.,초속 72m의 강풍과 리히터 규모 7의 지진도 견딜 수 있다. 해상의 교량 길이만 12.34km여서 바다 위 고속도로라고도 불린다. 손실분을 정부가 책임지는 최소수입보장(MRG)제로 계약해 개통 후부터 지난해까지...,http://news.donga.com/3/all/20170810/85761254/1
2466,방풍망 한라봉 첫 시도 최고봉 우뚝,2017.08.04.,태풍이나 강풍 폭우가 잦은 제주의 기상 특성 탓이다. 자칫 방풍망이 찢어지거나 무너질 가능성이 높다. 박 씨는 기초공사를 꼼꼼히 하는 방법으로 이겨냈다. 박 씨는 “시설물이 무너지면 철거하고 복구하는 데 막대한...,http://news.donga.com/3/all/20170823/85940013/1
2467,태풍 하토 홍콩마카오 강타 최소 7명 사망 실종,2017.08.04.,[동아일보] 13호 태풍 하토가 23일 홍콩 마카오와 중국 남부를 휩쓴 가운데 광둥성 주하이에서 나무가 강풍에 쓰러져 주차된 승용차들을 덮쳤다. 태풍 상륙 6시간 만에 마카오에서 3명이 사망하고 2명이 실종됐고...,http://news.donga.com/3/all/20170824/85959514/1
2468,홍콩 태풍 중국마카오 강타 후 피해 속출 비상,2017.08.24.,"특히 중국 광둥성 주하이에는 나무가 강풍에 쓰러져 주차된 승용차들을 덮쳤다. 광둥성 주하이 남부해역 인근에 근접했을 당시, 중심 풍속은 14급(초속 45m)에 달했다. 선전 북부로 향하는 90대의 고속철이 멈췄고...",http://news.donga.com/3/all/20170824/85960632/2
2469,홍콩마카오 태풍 하토로 쑥대밭 10명 사망피해액 1조,2017.08.24.,피해 현장에서 촬영된 영상들을 보면 사람들이 강풍에 몸을 가누지 못하는 것은 물론 나무 등도 쓰러진다. 저지대와 해안 지역이 침수돼 도로가 마비 됐다. 피해 현장에 있던 사람들은 인근 피난처...,http://news.donga.com/3/all/20170824/85963783/2
2470,이원주의 날 비바람 몰아치는데 왜 더웠을까,2017.08.24.,강한 비바람이 몰아친 24일 오후 서울 종로구 청계광장을 지나던 시민들이 강풍으로부터 우산을 지키느라 애를 쓰고 있다. 전영한 기자 scoopjyh@donga.com 23일부터 24일 오후 3시 반까지 내린 비는 총 45mm. 이 정도 비면...,http://news.donga.com/3/all/20170824/85973732/1
2471,카트리나 버금가는 4등급 허리케인 하비허리케인 등급 기준은,2017.08.28.,"가장 강한 5등급은 시속 156마일(250km) 이상의 강풍을 동반한 초강력 허리케인으로 지상에 서 있는... 1등급은 시속 74마일~95마일(118~152km)의 강풍으로, 지반이 약한 곳에 세워져 있는 관엽수, 간판 등 사소한...",http://news.donga.com/3/all/20170828/86044819/2
2472,등에 업은 아기 살리고 엄마는 하늘로 미국이 울었다,2017.08.28.,미국 국립기상청에 따르면 당시 보몬트 일대에는 시간당 50mm의 폭우가 쏟아지고 시속 60km가 넘는 강풍이 몰아치고 있었다. 급류에 휩싸인 휴스턴의 한 도로에선 주민들이 ‘인간 띠’를 이어 차량 안 노인을 구출하는...,http://news.donga.com/3/all/20170831/86112653/1
2473,최고등급 어마 카리브해 강타 섬 95 파괴돼,2017.08.28.,"인터넷에는 이미 강풍 피해를 본 미국령 버진제도 등에서 촬영된 파괴된 길과 쓰러진 나무들의 사진이 다수 게재됐다. 도널드 트럼프 대통령은 플로리다주와 푸에르토리코, 미국령 버진제도에 비상사태를 선포했다. 7일...",http://news.donga.com/3/all/20170908/86226736/1
2474,초강력 허리케인 어마 접근 플로리다 탈출 행렬휘발유 부족 비상,2017.09.08.,한편 7일 미국 국립허리케인센터(NHC)에 따르면 어마는 이날 오전 시속 290km의 강풍과 폭우를 동반하며 풍속 기준 최고 등급인 카테고리5를 유지한 채 서북서쪽으로 이동 중이다. 김혜란 ▶ 동아일보 단독 / 동아일보...,http://news.donga.com/3/all/20170908/86230529/2
2475,시속 160km 폭풍우 몰고온 어마 마이애미 대규모 정전,2017.09.08.,키스 제도를 현장 취재하던 CNN 기자는 강풍에 몸도 제대로 가누지 못했다. 어마가 플로리다 서부 해안을 따라 빠르게 북상하면서 피해는 점점 커지고 있다. 허리케인이 맹위를 떨치던 10일 오전 탬파시 남동부...,http://news.donga.com/3/all/20170911/86259854/1
2476,멕시코 강진 엎친 데 허리케인까지 덮쳐,2017.09.08.,카티아는 상륙 당시 최대 시속 120km의 강풍을 몰고 왔다. 미겔 앙헬 유네스 베라크루스주지사는 9일 “강물이 불어나 홍수 피해가 우려되고 있다”며 주의를 당부했다. 허리케인 카티아는 점차 열대성 폭풍으로...,http://news.donga.com/3/all/20170911/86259856/1
2477,제18호 태풍 탈림 북서진한반도 영향 가능성,2017.09.11.,"11일 기상청에 따르면 태풍 ‘탈림’은 오전 3시 기준 중심기압 990헥토파스칼(hPa)에 순간 최대풍속 24m의 강풍을 동반한 소형급 세력으로 이동하고 있다. 이동 속도는 28.0 km/h, 진행 방향은 서북서쪽이다. 지난 9일...",http://news.donga.com/3/all/20170911/86261892/2
2478,부산 집중호우에 일부 휴교부산 침수 피해 잇따라,2017.09.11.,"이와 함께 강풍주의보도 발효됐다. 이날 부산 지역 집중 호우로 침수 피해도 잇따르고 있다. 누리꾼들은 도로, 공장지대 침수 등의 사진 및 영상을 소셜미디어를 통해 공유하고 있다. 기상청 관계자는 “저기압의 영향과...",http://news.donga.com/3/all/20170911/86262335/2
2479,버스 바닥에 물이 부산 폭우 실시간 현장 사진 충격,2017.09.11.,부산기상청은 11일 오전 6시 50분 부산에 발효된 호우주의보를 호우경보로 격상하고 바람이 강하게 불 것으로 예상됨에 따라 강풍 주의보를 동시에 발령했다. 온라인에는 부산 폭우 상황을 담은 사진이 실시간으로...,http://news.donga.com/3/all/20170911/86262979/2
2480,부산 유치원초중고 전 학교 휴교조치180mm 쏟아져 부산 곳곳 침수,2017.09.11.,부산기상청은 11일 오전 6시 50분 부산에 발효된 호우주의보를 호우경보로 격상하고 바람이 강하게 불 것으로 예상됨에 따라 강풍 주의보를 동시에 발령했다. 부산기상청은 이날 오후까지 30∼70㎜의 비가 더 내릴...,http://news.donga.com/3/all/20170911/86263466/2
2481,서병수 시장 부산 폭우에도시철도 이용 추천,2017.09.11.,이와 함께 강풍주의보도 동시에 발령했다. 부산기상청은 이날 오후까지 30∼70㎜의 비가 더 내릴 것으로 예보하고 피해 예방을 당부했다. 김소정 ▶ 동아일보 단독 / 동아일보 공식 페이스북,http://news.donga.com/3/all/20170911/86264124/2
2482,허리케인 어마 피해 속출사망자 최소 28명 경제적 손실 만 296조원,2017.09.11.,미국 국립허리케인센터는 이날 오후 5시 기준 ‘어마’가 2등급으로 약화했으나 시속 177km의 강풍을... 강풍으로 대형 크레인 두 대가 쓰러지기도 했다. 허리케인 하비와 어마가 미국을 연달아 강타하면서 경제적...,http://news.donga.com/3/all/20170911/86270770/2
2483,플로리다 450만 가구기업 전기 끊겨  3분기 성장률 최대 1 떨어질 듯,2017.09.11.,[동아일보] 도시 침수… 3m 넘는 폭풍해일 ‘어마’ 상륙 후 위력은 약해져 초강력 허리케인 ‘어마’가 10일 미국 플로리다주에 상륙한 뒤 강풍과 폭우로 4명이 사망하고 450만 가구 및 기업이 정전 피해를 입었다....,http://news.donga.com/3/all/20170912/86279078/1
2484,탈림 태풍경로 북서진 한반도 영향 가능성,2017.09.12.,"12일 기상청에 따르면 태풍 ‘탈림’은 이날 오전 10시 기준, 중심기압 975헥토파스칼(hPa)에 순간 최대풍속 32m의 강풍을 동반한 소형급 세력으로 이동하고 있다. 이동 속도는 38.0 km/h, 진행 방향은 북서쪽이다. 지난 9일...",http://news.donga.com/3/all/20170912/86287966/2
2485,제18호 태풍 탈림 경로 보니상하이 앞바다서 턴  규슈 강타,2017.09.12.,"사진=대만 기상청 캡처 사진=우리나라 기상청 캡처 국내 기상청에 따르면 태풍 ‘탈림’은 12일 오전 10시 기준, 중심기압 975헥토파스칼(hPa)에 순간 최대풍속 초속 32m의 강풍을 동반한 소형급이며 시속 38.0 km의...",http://news.donga.com/3/all/20170912/86290572/2
2486,탈림 태풍 경로 보니16일 제주도 간접 영향권,2017.09.13.,"13일 기상청에 따르면 태풍 ‘탈림’은 이날 오전 4시 기준, 중심기압 965헥토파스칼(hPa)에 순간 최대풍속 37m의 강풍을 동반한 중형급 세력이며 시속 24.0 km/h의 속력으로 북서진하고 있다. 지난 9일 발생한 태풍...",http://news.donga.com/3/all/20170913/86299907/2
2487,태풍 탈림 북상17일  규슈 강타,2017.09.13.,국내 기상청에 따르면 지난 9일 발생한 태풍 ‘탈림’은 이날 오전 4시 기준 중심기압 965헥토파스칼(hPa)에 순간 최대풍속 37m의 강풍을 동반한 중형급 세력이며 시속 24.0 km/h의 속력으로 북서진하고 있다. 태풍...,http://news.donga.com/3/all/20170913/86300248/2
2488,강력한 태풍 탈림 북상 한중일 초긴장 앞바다서 턴 관통 유력,2017.09.13.,"중심기압 960헥토파스칼(hPa), 최대풍속 140km/h, 강풍반경 320km의 강한 중형 태풍이다. 태풍 탈림은 14일 타이완 북동쪽 해상을 지나 중국 남동부 해안을 향해 달려들다 유(U)턴하듯 방향을 오른쪽으로 급하게 꺾어 일본...",http://news.donga.com/3/all/20170913/86302774/2
2489,태풍 탈림 16일밤 제주 남쪽 300km해상까지 북상카테고리2 수준,2017.09.13.,"국가태풍센터 관계자는 “16일 밤쯤 제주도 남쪽 먼 바다 300㎞ 해상까지 접근할 것으로 예상되면서 해상은 직접적, 육상은 간접적인 영향을 받을 것”이라며 “약간만 북쪽으로 올라오면 제주도도 강풍 영향권에...",http://news.donga.com/3/all/20170913/86308354/2
2490,제18호 태풍 탈림 일본 규슈로 향하나제주도에 미치는 영향은,2017.09.13.,"중심기압 960hPa(헥토파스칼), 최대풍속 초속 39ｍ, 강풍 반경 350㎞로, 강도 ‘강’에 중형 크기이며, 시속 13㎞의 속도로 북서진하고 있다. 14일 오후 3시에는 중국 상하이 남남동쪽 약 470km 부근 해상을, 15일 오후...",http://news.donga.com/3/all/20170913/86311842/2
2491,태풍 탈림 경로 에 최악 시나리오주요 4개섬 모두 통과,2017.09.13.,"태풍 탈림은 중심기압 960hPa(헥토파스칼), 최대풍속 초속 39ｍ, 강풍 반경 350㎞로, 강한 중형 태풍을 유지하고 있다. 일본 기상청의 태풍 탈림 예상 경로. 일보 주요 4개섬을 모두 거쳐 이동할 것으로 예측했다. 중국...",http://news.donga.com/3/all/20170913/86311967/2
2492,2017한국품질만족지수 친환경 기술로 실란트 개발 주도하는  코레실,2017.09.13.,특히 초고층 건물의 경우는 강풍에도 맞설 만큼 강력한 물성을 지녀야 한다. 또 한편으로는 창을 열어 자연환기가 힘든 내부 재실자를 위해 인체에 무해한 성분이어야 한다. KCC의 건축용 실란트 제품은 국내 최초로...,http://news.donga.com/3/all/20170913/86310547/1
2493,탈림 태풍경로 보니세력 키워 북상 ,2017.09.14.,"14일 기상청에 따르면 태풍 ‘탈림’은 이날 오전 4시 기준, 중심기압 945헥토파스칼(hPa)에 순간 최대풍속 45m의 강풍을 동반한 중형급 세력이며 시속 12.0 km/h의 속력으로 북서진하고 있다. 지난 9일 발생한 태풍...",http://news.donga.com/3/all/20170914/86321210/2
2494,태풍 탈림 허리케인 어마와 맞먹는 위력제주 태풍 간접 영향,2017.09.14.,45m의 강풍을 동반한 중형급 세력이며 시속 12.0 km/h의 속력으로 북서진하고 있다. 사진=기상청 캡처... 어마가 몰고 온 강풍·호우·해일 등으로 카리브해 섬 주민들과 플로리다 주 주민 수 십 명이 사망한 것으로...,http://news.donga.com/3/all/20170914/86323524/2
2495,태풍 탈림 영향 제주에 강풍비 태풍 경로 예상대로  규슈로,2017.09.15.,"[동아닷컴] 태풍 탈림 영향, 제주에 강풍·비 …태풍 경로, 예상대로 日 규슈로/천리안 위성이 촬영한 태풍... 제주도 육상 전역에는 강풍주의보가 발령됐다. 태풍 탈림은 이날 오전 3시 현재 중심기압 945헥토파스칼(hPa)...",http://news.donga.com/3/all/20170915/86342122/2
2496,제18호 태풍 탈림 제주 간접 영향누리꾼  반응 보니,2017.09.15.,"이날 오전 10시 기상청 자료에 따르면 태풍 탈림은 오전 9시 기준, 중심기압 945헥토파스칼(hPa)에 순간 최대풍속 45m의 강풍을 동반한 중형급 세력이며 시속 8.0 km/h의 속력으로 북동진하고 있다. 북상 중인 탈림의 현재...",http://news.donga.com/3/all/20170915/86345592/2
